{
  "$schema": "https://json-schema.org/draft/2020-12/schema",
  "$id": "urn:x86decomp:schema:relink-manifest:1",
  "title": "Manifest-driven full relink",
  "type": "object",
  "additionalProperties": false,
  "required": [
    "schema_version",
    "linker",
    "objects",
    "output",
    "arguments",
    "environment",
    "timeout_seconds"
  ],
  "properties": {
    "schema_version": {
      "const": 1
    },
    "linker": {
      "type": "string",
      "minLength": 1
    },
    "objects": {
      "type": "array",
      "minItems": 1,
      "items": {
        "type": "string"
      }
    },
    "output": {
      "type": "string",
      "minLength": 1
    },
    "arguments": {
      "type": "array",
      "minItems": 1,
      "items": {
        "type": "string"
      },
      "contains": {
        "pattern": "\\{output\\}"
      }
    },
    "environment": {
      "type": "object",
      "additionalProperties": {
        "type": "string"
      }
    },
    "inherit_environment": {
      "type": "boolean"
    },
    "timeout_seconds": {
      "type": "integer",
      "minimum": 1
    },
    "reference_image": {
      "type": "string"
    }
  }
}
