{
  "schema_version": 1,
  "linker": "lld-link",
  "objects": ["entry.obj"],
  "output": "linked.exe",
  "arguments": [
    "/nologo",
    "/machine:x64",
    "/entry:entry",
    "/subsystem:console",
    "/nodefaultlib",
    "/out:{output}",
    "{objects}"
  ],
  "environment": {},
  "inherit_environment": true,
  "timeout_seconds": 60
}
